company_name,website,industry,summary_from_llm,target_customer,employee_count,founding_year,automation_pitch_from_llm
Google,https://google.io,N/A,N/A,N/A,N/A,N/A,""" QF Innovate could pitch to Google the idea of using natural language processing to create personalized and adaptable virtual conference assistants. This AI automation would listen to keynotes and speeches at Google I/O, and transcribe them in real-time. 
 These transcripts could then be annotated with sentiment analysis and contextual markers to highlight key information and emotional cues. This system could provide real-time summaries of speeches and allow users to search for specific information within the conference proceedings, improving accessibility and creating new pathways for information retention and engagement.""
}
```"
Microsoft,https://www.microsoft.com,"Cloud Software, Hardware, Technology","Microsoft is a multinational technology company headquartered in Washington, USA. It is a pioneer in the personal computer revolution and has since expanded its products and services to cloud computing, software, and hardware, making it a leading provider of end-to-end solutions for consumers and businesses.","Microsoft's primary target customers encompass individuals, small businesses, enterprises, and corporate professionals seeking productivity and connectivity through innovative devices, software, and cloud services.","163,000
 Founding Year: 1975",1975,"Pitch Topic: Enhanced Customer Experience and Support Using AI

Microsoft has revolutionized the personal computing industry, but with its growth in scale and diversity of products, it needs tailored and cohesive methods for fielding and responding to customer inquiries. 

QF Innovate's pitch to Microsoft: ""Microsoft Morgana"" (named after the mythological figure symbolic of transformation): 

Artificial Intelligence (AI) Automation Idea:
1. Comprehensive AI-Driven Customer Experience: Microsoft Morgana uses advanced NLP and machine learning to offer seamless and personalized customer support via multiple channels, including chatbots, voice assistants, and integrated support within Microsoft products.
2. Proactive Support Transformation: Morgana goes beyond reactive support by integrating AI into the fabric of Microsoft products and services. It analyzes user behavior, predicts potential issues, and offers solutions even before customers realize them.
3. Unified Support Across Microsoft Ecosystem: Morgana ensures consistency in support across Microsoft's diverse products and services, regardless of platform or device, providing a unified experience that enhances customer loyalty. 
4. Advanced Case Routing and Human Collaboration: Microsoft Morgana uses AI to accurately route complex cases to the most appropriate human agents within Microsoft's support team, providing them with relevant context and suggestions for efficient case resolution. 
5. Continuous Learning and Optimization: Morgana employs machine learning to learn from every customer interaction. This enables Microsoft to continuously refine and improve its products and support processes, ensuring that the company stays ahead of the rapidly evolving market. 
6. Seamless Integration with Existing Systems: Morgana is designed to integrate effortlessly with Microsoft's existing customer relationship management (CRM) systems, support tools, and product platforms, ensuring a smooth and cost-effective implementation. 

Microsoft Morgana revolutionizes customer experience through AI, turning inquiries into meaningful interactions, enhancing user satisfaction, and fostering loyalty for Microsoft's expansive"
OpenAI,http://www.openai.net,Artificial Intelligence,"OpenAI Laboratory is a company that creates AI-related products and services. They aim to establish a meaningful artificial intelligence, with a focus on creating new technologies that can benefit multiple industries.","The primary target customers are other businesses across various industries, who would use OpenAI's products, services or infrastructure to enhance their own offerings or streamline their operations.",N/A,2006,"An AI automation idea for OpenAI is to develop and implement a large language model (LLM) that can understand and generate code. This LLM could be used to assist in the development of new AI projects, streamlining the process and potentially reducing the time and resources needed to get new products to market. 

The LLM could operate within a collaborative coding environment, where human programmers and engineers could pair program with the AI to solve complex problems and identify new innovative solutions. 

This approach could enhance OpenAI's operations, improve their products, and expand their market reach, establishing them as a leading developer of advanced AI systems."
Amazon,https://www.amazon.io,"The primary industry of Amazon operates in is E-commerce and Cloud Computing, with significant innovations and applications of AI in areas like fraud detection, sales optimization through recommendation engines, and AI capabilities offered through their AWS platform.","Amazon is a company that uses AI innovations to stop fraud and counterfeits, enhance transportation, and empower female entrepreneurs. They are committed to fostering diversity and sustainability, as evident from their initiatives like AWS AI powers new water projects in Spain and the Spotlight on women in transportation.","Amazon's target customers seem to be broad and diverse. They cater to individual consumers looking for a wide range of shopping options and a convenient shopping experience. They also cater to small and large businesses, empowering entrepreneurs and enterprises alike through their platform. Amazon sells to other businesses as well, offering business-to-business (B2B) services.",The text does not explicitly provide or infer the number of employees.,"The founding year of Amazon is 1994, making it a well-established company that has evolved over decades to become a dominant player in e-commerce and cloud services.","One of Amazon's challenges is managing an extensive and global supply chain, transportation, and logistics operations. Amazon could improve its operational efficiency and customer satisfaction with AI automation. Pitch the following solution: 
QF Innovate's proposal to Amazon involves revolutionary AI automation in logistics and supply chain management. By integrating cutting-edge AI optimization and machine learning technologies, Amazon can enhance its logistics network by: 

1. AI Route Optimization: Maximize delivery efficiency by generating optimal routes for delivery drivers in real time, considering traffic patterns, weather conditions, and other dynamic factors. 

2. Autonomous Warehousing: Implement advanced robotic processes and vision technologies to automate repetitive tasks in warehouses. This includes robot pickers, packers, and streamlined inventory management systems, reducing costs and improving fulfillment speeds. 

3. Supply Chain Predictive Analytics: Leverage predictive analytics using historical and real-time data to forecast demand, optimize inventory levels across distribution centers, and minimize stockouts or overstock scenarios. 

4. Enhanced Customer Communication: Deliver real-time order tracking and proactive delivery updates to customers through AI-powered chatbots or personalized email notifications, leading"
